{
  "schema_version": "fdx4.protected-corpus-manifest/v1",
  "corpus_digest": "3f4a2b3c73f5c9910bded44c31af53920dbd0a9097d2892839eb18585c8adbb9",
  "datasheet_revision": "430d487b882e6c1d0bf3d6962525c4a283789283",
  "foundry_revision": "bb7f197b3551bd3fd58e9db668230baf879dcb77",
  "ontology_snapshot_digest": "942c84a70c2ae0c45aa5665ecb85e03abbefdbf8fdd20760dedc99594d27511e",
  "calibration_snapshot_digest": "72558d93b74ffdd9c85bf7013261a4b01aa15fdaf22ddbf758f3719bf9101040",
  "builder_configuration_digest": "55fc03964c74a4721f8cb2db7a1b1ce1437bd52045aa5023fba5fb2d68b0d7be",
  "inputs": [
    {
      "role": "audited_fdx3_nasa_production_bundle",
      "content_sha256": "5f859c8944f3306f5219f1aea8aa7f545c3e815100e88bd1e523dd66b63fb892",
      "logical_id": "government.nasa.nepp.npsl.lp_npt",
      "row_count": 210
    }
  ],
  "members": [
    {
      "example_id": "06159456a208b8727931eee80c16cdf5841bba1a49b91e9a0a09f55b50804d7e",
      "example_content_sha256": "ba76fdac76d71706560469eff7338088e1ca6e5664860174f6ff8f951c459168",
      "assigned_split": "train",
      "document_family_id": "government.nasa.nepp.npsl.lp_npt",
      "lineage_group_ids": [
        "acb5f16ea0ef4dc35c6b4984844da1fc7c2c25531aa52d4036119587c9a70368"
      ],
      "near_duplicate_group_id": "7ac3a1c7eacfaeaed7c3a3b625fb781fd00e5598224b018961dcc053faa15a81",
      "revision_group_id": "ce4fa8a485df29554b12a3e725f9b15c4faee7ce8ea8936f00be69daca1a194f",
      "rights_snapshot_ids": [
        "d06bd6f87ceda8f37ff9c1aaaa1d9b9cccc79cff4c21fbf933bb7dcf499dcf69"
      ],
      "training_permitted": true,
      "restriction_codes": []
    },
    {
      "example_id": "075bbec7e261a4d1ea4587c043dce708aceda754d9729de2fb8b7d26bdb218ce",
      "example_content_sha256": "2f6577062582c68f35893e0046ef7bcdc59da8396da27167461b48e9066f954a",
      "assigned_split": "train",
      "document_family_id": "government.nasa.nepp.npsl.lp_npt",
      "lineage_group_ids": [
        "acb5f16ea0ef4dc35c6b4984844da1fc7c2c25531aa52d4036119587c9a70368"
      ],
      "near_duplicate_group_id": "7ac3a1c7eacfaeaed7c3a3b625fb781fd00e5598224b018961dcc053faa15a81",
      "revision_group_id": "ce4fa8a485df29554b12a3e725f9b15c4faee7ce8ea8936f00be69daca1a194f",
      "rights_snapshot_ids": [
        "d06bd6f87ceda8f37ff9c1aaaa1d9b9cccc79cff4c21fbf933bb7dcf499dcf69"
      ],
      "training_permitted": true,
      "restriction_codes": []
    },
    {
      "example_id": "083db0d72a00387889b3c92862671c8a3e82ff9e3515afe4de9b4e4fc45469c7",
      "example_content_sha256": "7f6041fe91084ce8739ade256dac0bb3d59a5080f7a30164e89bcc2e95c901b6",
      "assigned_split": "train",
      "document_family_id": "government.nasa.nepp.npsl.lp_npt",
      "lineage_group_ids": [
        "acb5f16ea0ef4dc35c6b4984844da1fc7c2c25531aa52d4036119587c9a70368"
      ],
      "near_duplicate_group_id": "7ac3a1c7eacfaeaed7c3a3b625fb781fd00e5598224b018961dcc053faa15a81",
      "revision_group_id": "ce4fa8a485df29554b12a3e725f9b15c4faee7ce8ea8936f00be69daca1a194f",
      "rights_snapshot_ids": [
        "d06bd6f87ceda8f37ff9c1aaaa1d9b9cccc79cff4c21fbf933bb7dcf499dcf69"
      ],
      "training_permitted": true,
      "restriction_codes": []
    },
    {
      "example_id": "0992b28dcc89110ebd699d798f5aa03f42a5b3e297facb065acdcee2bc017345",
      "example_content_sha256": "ee1651d5e5515dc423a24c59f3d0b9fb3f0663fa8d4bf1f101b1c93e96fed842",
      "assigned_split": "train",
      "document_family_id": "government.nasa.nepp.npsl.lp_npt",
      "lineage_group_ids": [
        "acb5f16ea0ef4dc35c6b4984844da1fc7c2c25531aa52d4036119587c9a70368"
      ],
      "near_duplicate_group_id": "7ac3a1c7eacfaeaed7c3a3b625fb781fd00e5598224b018961dcc053faa15a81",
      "revision_group_id": "ce4fa8a485df29554b12a3e725f9b15c4faee7ce8ea8936f00be69daca1a194f",
      "rights_snapshot_ids": [
        "d06bd6f87ceda8f37ff9c1aaaa1d9b9cccc79cff4c21fbf933bb7dcf499dcf69"
      ],
      "training_permitted": true,
      "restriction_codes": []
    },
    {
      "example_id": "0a6956de9b3021dd113b97afbaee9d22cd59823d1c0747aa6f31373759995686",
      "example_content_sha256": "60544421d93d1d404bc87cbafa05ccf07ee629cb2fb8e057c6280ea9468ccb8b",
      "assigned_split": "train",
      "document_family_id": "government.nasa.nepp.npsl.lp_npt",
      "lineage_group_ids": [
        "acb5f16ea0ef4dc35c6b4984844da1fc7c2c25531aa52d4036119587c9a70368"
      ],
      "near_duplicate_group_id": "7ac3a1c7eacfaeaed7c3a3b625fb781fd00e5598224b018961dcc053faa15a81",
      "revision_group_id": "ce4fa8a485df29554b12a3e725f9b15c4faee7ce8ea8936f00be69daca1a194f",
      "rights_snapshot_ids": [
        "d06bd6f87ceda8f37ff9c1aaaa1d9b9cccc79cff4c21fbf933bb7dcf499dcf69"
      ],
      "training_permitted": true,
      "restriction_codes": []
    },
    {
      "example_id": "0d4f8848ad68c548a92dbe51353a9bd1635bbbb81f6517878f5e886cf6a306b7",
      "example_content_sha256": "920db5c763aff9593f9761ad0d48794ad5e14ad6c97119c8013003dbf6a64859",
      "assigned_split": "train",
      "document_family_id": "government.nasa.nepp.npsl.lp_npt",
      "lineage_group_ids": [
        "acb5f16ea0ef4dc35c6b4984844da1fc7c2c25531aa52d4036119587c9a70368"
      ],
      "near_duplicate_group_id": "7ac3a1c7eacfaeaed7c3a3b625fb781fd00e5598224b018961dcc053faa15a81",
      "revision_group_id": "ce4fa8a485df29554b12a3e725f9b15c4faee7ce8ea8936f00be69daca1a194f",
      "rights_snapshot_ids": [
        "d06bd6f87ceda8f37ff9c1aaaa1d9b9cccc79cff4c21fbf933bb7dcf499dcf69"
      ],
      "training_permitted": true,
      "restriction_codes": []
    },
    {
      "example_id": "10b92840a28878b4ef82e245a45761c7f5c47d6ac2cc3379f92339ea0e3ff34d",
      "example_content_sha256": "bc7770610199d160e58eca138b27020cfc18090386f30e5cff844ab8a9227e6f",
      "assigned_split": "train",
      "document_family_id": "government.nasa.nepp.npsl.lp_npt",
      "lineage_group_ids": [
        "acb5f16ea0ef4dc35c6b4984844da1fc7c2c25531aa52d4036119587c9a70368"
      ],
      "near_duplicate_group_id": "7ac3a1c7eacfaeaed7c3a3b625fb781fd00e5598224b018961dcc053faa15a81",
      "revision_group_id": "ce4fa8a485df29554b12a3e725f9b15c4faee7ce8ea8936f00be69daca1a194f",
      "rights_snapshot_ids": [
        "d06bd6f87ceda8f37ff9c1aaaa1d9b9cccc79cff4c21fbf933bb7dcf499dcf69"
      ],
      "training_permitted": true,
      "restriction_codes": []
    },
    {
      "example_id": "10c173cad2221f68f3ea9e7d4b616697ffb2a0af42fecc9c6b8f8ae6b67434e7",
      "example_content_sha256": "813cbbeee2def11a3f4251b0095ec5cf05977f993837d1263f5d148014ef343a",
      "assigned_split": "train",
      "document_family_id": "government.nasa.nepp.npsl.lp_npt",
      "lineage_group_ids": [
        "acb5f16ea0ef4dc35c6b4984844da1fc7c2c25531aa52d4036119587c9a70368"
      ],
      "near_duplicate_group_id": "7ac3a1c7eacfaeaed7c3a3b625fb781fd00e5598224b018961dcc053faa15a81",
      "revision_group_id": "ce4fa8a485df29554b12a3e725f9b15c4faee7ce8ea8936f00be69daca1a194f",
      "rights_snapshot_ids": [
        "d06bd6f87ceda8f37ff9c1aaaa1d9b9cccc79cff4c21fbf933bb7dcf499dcf69"
      ],
      "training_permitted": true,
      "restriction_codes": []
    },
    {
      "example_id": "1154c76a9b0ae8f727214ff6b61b2c796571c7808ea120ca9d0cc175d180ea10",
      "example_content_sha256": "0fd9b61ca541d6c41f86da77a6ce807d5cf069c7e2a3f641991608f9f2ae2f61",
      "assigned_split": "train",
      "document_family_id": "government.nasa.nepp.npsl.lp_npt",
      "lineage_group_ids": [
        "acb5f16ea0ef4dc35c6b4984844da1fc7c2c25531aa52d4036119587c9a70368"
      ],
      "near_duplicate_group_id": "7ac3a1c7eacfaeaed7c3a3b625fb781fd00e5598224b018961dcc053faa15a81",
      "revision_group_id": "ce4fa8a485df29554b12a3e725f9b15c4faee7ce8ea8936f00be69daca1a194f",
      "rights_snapshot_ids": [
        "d06bd6f87ceda8f37ff9c1aaaa1d9b9cccc79cff4c21fbf933bb7dcf499dcf69"
      ],
      "training_permitted": true,
      "restriction_codes": []
    },
    {
      "example_id": "11680c883d7e7dc4dd764bb51e0317baad4df8a039b2044dd9bc686f60de6807",
      "example_content_sha256": "0e71ffcfd407bebcb1da314fac4f960e059e28ae67b2662ad4f1f819455d9f35",
      "assigned_split": "train",
      "document_family_id": "government.nasa.nepp.npsl.lp_npt",
      "lineage_group_ids": [
        "acb5f16ea0ef4dc35c6b4984844da1fc7c2c25531aa52d4036119587c9a70368"
      ],
      "near_duplicate_group_id": "7ac3a1c7eacfaeaed7c3a3b625fb781fd00e5598224b018961dcc053faa15a81",
      "revision_group_id": "ce4fa8a485df29554b12a3e725f9b15c4faee7ce8ea8936f00be69daca1a194f",
      "rights_snapshot_ids": [
        "d06bd6f87ceda8f37ff9c1aaaa1d9b9cccc79cff4c21fbf933bb7dcf499dcf69"
      ],
      "training_permitted": true,
      "restriction_codes": []
    },
    {
      "example_id": "11ce50f8ed2f6ffcc32861ed63c033551d6b489f8cb4d831721c6131cc595a0a",
      "example_content_sha256": "d626b16a846c194279179d810a52d6afded034cd0883cc39ff9a27cb8144ff7f",
      "assigned_split": "train",
      "document_family_id": "government.nasa.nepp.npsl.lp_npt",
      "lineage_group_ids": [
        "acb5f16ea0ef4dc35c6b4984844da1fc7c2c25531aa52d4036119587c9a70368"
      ],
      "near_duplicate_group_id": "7ac3a1c7eacfaeaed7c3a3b625fb781fd00e5598224b018961dcc053faa15a81",
      "revision_group_id": "ce4fa8a485df29554b12a3e725f9b15c4faee7ce8ea8936f00be69daca1a194f",
      "rights_snapshot_ids": [
        "d06bd6f87ceda8f37ff9c1aaaa1d9b9cccc79cff4c21fbf933bb7dcf499dcf69"
      ],
      "training_permitted": true,
      "restriction_codes": []
    },
    {
      "example_id": "1454cc5e4cb9a4b45d1d5b8ff80b65af82120ba6df4953585a8948c1b1e3ca01",
      "example_content_sha256": "b11510b8ae5bc2fd3e48f6ea65c764e1bcff49f8fcc137606f107e814f69d316",
      "assigned_split": "train",
      "document_family_id": "government.nasa.nepp.npsl.lp_npt",
      "lineage_group_ids": [
        "acb5f16ea0ef4dc35c6b4984844da1fc7c2c25531aa52d4036119587c9a70368"
      ],